{
  "$schema": "http://json-schema.org/draft-07/schema#",
  "$id": "https://polyglottos.com/schemas/course-metadata.json",
  "title": "Course Metadata Schema",
  "description": "Schema for course metadata in Polyglottos language learning platform",
  "type": "object",
  "required": [
    "title",
    "description",
    "sourceLanguage",
    "targetLanguage",
    "difficulty",
    "estimatedHours",
    "version"
  ],
  "properties": {
    "title": {
      "type": "string",
      "description": "Course title",
      "minLength": 5,
      "maxLength": 100
    },
    "description": {
      "type": "string",
      "description": "Course description",
      "minLength": 20,
      "maxLength": 500
    },
    "sourceLanguage": {
      "type": "string",
      "description": "Source language code (ISO 639-1)",
      "pattern": "^[a-z]{2}$"
    },
    "targetLanguage": {
      "type": "string",
      "description": "Target language code (ISO 639-1)",
      "pattern": "^[a-z]{2}$"
    },
    "difficulty": {
      "type": "string",
      "enum": ["beginner", "intermediate", "advanced"],
      "description": "Course difficulty level"
    },
    "estimatedHours": {
      "type": "number",
      "minimum": 1,
      "maximum": 200,
      "description": "Estimated completion time in hours"
    },
    "version": {
      "type": "string",
      "pattern": "^\\d+\\.\\d+\\.\\d+$",
      "description": "Semantic version of the course content"
    },
    "tags": {
      "type": "array",
      "items": {
        "type": "string",
        "minLength": 2,
        "maxLength": 20
      },
      "uniqueItems": true,
      "description": "Optional tags for categorization"
    },
    "prerequisites": {
      "type": "array",
      "items": {
        "type": "string"
      },
      "description": "List of prerequisite courses or skills"
    },
    "authors": {
      "type": "array",
      "items": {
        "type": "object",
        "required": ["name"],
        "properties": {
          "name": {
            "type": "string",
            "minLength": 2,
            "maxLength": 50
          },
          "email": {
            "type": "string",
            "pattern": "^[a-zA-Z0-9._%+-]+@[a-zA-Z0-9.-]+\\.[a-zA-Z]{2,}$"
          },
          "github": {
            "type": "string",
            "pattern": "^[a-zA-Z0-9]([a-zA-Z0-9-])*[a-zA-Z0-9]$"
          }
        }
      },
      "minItems": 1,
      "description": "Course authors information"
    },
    "lastUpdated": {
      "type": "string",
      "pattern": "^\\d{4}-\\d{2}-\\d{2}$",
      "description": "Last update date in YYYY-MM-DD format"
    }
  },
  "additionalProperties": false
}